{
  "schema_version": "2",
  "job_id": "fixture-table-manipulate-v2",
  "capability": "table.manipulate.v1",
  "inputs": [
    {
      "artifact_id": "input-table",
      "role": "table",
      "cardinality": "single",
      "files": [
        {
          "file_id": "input-table-1",
          "path": "../expression-matrix/counts.tsv",
          "format": "tsv",
          "compression": "none",
          "size_bytes": 90,
          "sha256": "6e581e0bf02c9a905f54de8865698f8dc9ea20113a8a03e69389cca954e090c6"
        }
      ]
    }
  ],
  "execution": {
    "mode": "local-cpu"
  },
  "parameters": {
    "output": "../../../target/test-results/table-manipulate-v2.tsv",
    "drop_columns": ["sample_c"],
    "filter_column": "gene_id",
    "filter_op": "contains",
    "filter_value": "gene_",
    "limit": 2
  }
}
