{
  "schema_version": "2",
  "job_id": "fixture-sequence-kmer-count-v2",
  "capability": "sequence.kmer.count.v1",
  "inputs": [{
    "artifact_id": "input-fasta",
    "role": "fasta",
    "cardinality": "single",
    "files": [{
      "file_id": "input-fasta-1",
      "path": "../sequence-analysis/reference.fa",
      "format": "fasta",
      "compression": "none",
      "size_bytes": 41,
      "sha256": "85c6aa5f070b2e8450cc2c70fb0756f21985bf78fa9089bfdcfc31150739aa0c"
    }]
  }],
  "execution": {"mode": "local-cpu"},
  "parameters": {
    "output": "../../../target/test-results/sequence-kmer-count-v2.tsv",
    "k": 3,
    "canonical": true,
    "top_n": 5
  }
}
