{
  "schema_version": "2",
  "job_id": "fixture-sequence-convert-v2",
  "capability": "sequence.convert.biopython.v1",
  "inputs": [
    {
      "artifact_id": "input-sequences",
      "role": "sequences",
      "cardinality": "single",
      "files": [{
        "file_id": "input-sequences-1",
        "path": "../sequences/tiny.fa",
        "format": "fasta",
        "compression": "none",
        "size_bytes": 32,
        "sha256": "d36ea1364a0451fd99584f0f36307dbc34b818ca4008c24c7705a95855172a1c"
      }]
    }
  ],
  "execution": {"mode": "local-cpu"},
  "parameters": {
    "output_directory": "../../../target/test-results/sequence-convert-v2",
    "output_filename": "converted.genbank",
    "output_format": "genbank"
  }
}
