{
  "schema_version": "2",
  "job_id": "fixture-protein-domain-visualize-v2",
  "capability": "protein.domain.visualize.v1",
  "inputs": [{
    "artifact_id": "input-domains",
    "role": "domains",
    "cardinality": "single",
    "files": [{
      "file_id": "input-domains-1",
      "path": "../protein-domains/interproscan.tsv",
      "format": "protein-domains",
      "compression": "none",
      "size_bytes": 386,
      "sha256": "872368d9fbf78720f4c69bf2debb8b7fd589c1f0cda0e50b3e9e56f280f794ad"
    }]
  }],
  "execution": {"mode": "local-cpu"},
  "parameters": {
    "output": "../../../target/test-results/protein-domains-v2.svg",
    "max_sequences": 10,
    "max_domains": 50
  }
}
