{
    "schema_version": "2",
    "job_id": "fixture-phylogeny-tree-visualize-v2",
    "capability": "phylogeny.tree.visualize.v1",
    "inputs": [
        {
            "artifact_id": "tree",
            "role": "tree",
            "cardinality": "single",
            "files": [
                {
                    "file_id": "tree-1",
                    "path": "../phylogeny/tree.nwk",
                    "format": "newick",
                    "compression": "none",
                    "size_bytes": 0
                }
            ]
        }
    ],
    "execution": {
        "mode": "local-cpu"
    },
    "parameters": {
        "output": "../../../target/test-results/tree-visualize-v2.svg",
        "width": 800,
        "height": 600,
        "show_branch_lengths": false
    }
}