{
  "schema_version": "2",
  "job_id": "fixture-expression-cluster-v2",
  "capability": "expression.cluster.v1",
  "inputs": [{
    "artifact_id": "input-matrix",
    "role": "matrix",
    "cardinality": "single",
    "files": [{
      "file_id": "input-matrix-1",
      "path": "../expression-matrix/analysis.tsv",
      "format": "tsv",
      "compression": "none",
      "size_bytes": 141,
      "sha256": "dce5558fea997c56854cacc373f863cc4ee6a744450a0f0191f01e62cdb9b31f"
    }]
  }],
  "execution": {"mode": "local-cpu"},
  "parameters": {
    "sample_clusters": 2,
    "feature_clusters": 3,
    "max_iterations": 100,
    "scale_features": true
  }
}
